Labels,Text,Text_Tag,Label_Text
5,"In 1992, Mitt Romney gave money to Democrats for Congress.","bipartisanship,campaign-finance,candidates-biography",True
1,Harry Reids plan is basically giving the president a blank check.,"deficit,federal-budget",False
1,Says he saw videotape of the people taking the money off the plane to pay ransom to Iran for hostages.,foreign-policy,False
5,Says there have been no cases of wolves killing people in Rocky Mountain states.,environment,True
1,Sixty-one percent of our bridges are in trouble.,"infrastructure,transportation",False
1,"Jeff Merkley was the deciding vote on Obamacare, which in Oregon has been an unmitigated disaster.",health-care,False
5,A 5 percent increase in domestic production would increase the world supply by less than 1 percent and do almost nothing to our dependence on foreign oil. This would also have virtually no effect on the price of gas at the pump.,"environment,oil-spill",True
1,"Every time the price of gasoline rises 1 cent, its abillion dollarsout of our economy that goes to Saudi Arabia.","corrections-and-updates,economy,energy,iraq",False
5,"During the recent global warming summit in Copenhagen, Nancy Pelosi and others stayed at a five-star hotel on a trip costing nearly $10,000 per person.",transportation,True
1,Says Donald Trump hasnt broken his promise to release his tax returns.,"candidates-biography,taxes",False
5,We cut taxes for 95 percent of working families.,"economy,stimulus,taxes,workers",True
1,The United States has a record number of abortions year after year after year.,abortion,False
5,Drone technology now allows an individual to be recorded in their homes by drones as small as birds and immediately uploaded to the internet.,"crime,privacy",True
1,Says the first word spoken from the moon was Houston.,space,False
5,"The gun epidemic is the leading cause of death of young African-American men, more than the next nine causes put together.","diversity,guns,public-health",True
1,"As Secretary of State, Hillary Clinton laundered money to Bill Clinton through Laureate Education, while Bill Clinton was an honorary chairman of the group.","candidates-biography,ethics",False
5,The black unemployment rate (has) increased since the recovery has begun.,"economy,jobs,workers",True
5,Says the media distortedwhat happened with a baby at his rally.,"candidates-biography,children",True
5,Says only 18 percent of Portland elementary schools have art instruction compared to 83 percent nationally.,education,True
1,"After Hurricane Katrina, Dallas and San Antonio took in 5,000 to 10,000 refugees each, but (Bill) White brought in 250,000 and put them up in his buddies empty apartment buildings and let the federal government pay their rents for over two years. They did not return to New Orleans, most of them are on welfare.","candidates-biography,ethics,natural-disasters",False
1,Says salaries and benefits for Wisconsin state employee comprised 8.5 percent of the 2009-2011 state budget.,"labor,state-budget",False
1,Mary Burke wasted 12.5 million dollars on a vacant lot in a move that could cost taxpayers nearly $25 million.,"government-efficiency,jobs,state-budget",False
5,American oil production is at its highest level since 2003.,energy,True
5,"President Obama budget request for veterans ismore than double the amount in constant dollars appropriated in 1980, when the veterans population was larger by a third.","federal-budget,veterans",True
1,Seventy percent of the people in the state of New Jersey want marriage equality.,"gays-and-lesbians,marriage",False
5,Says GOP Senate nominee Darryl Glenn said he wants to see Ted Cruz appointed to the U.S. Supreme Court.,supreme-court,True
5,People have actually broken down the transcripts for oral arguments and (Antonin Scalia) told more jokes and got more laughs than any of the other justices.,supreme-court,True
5,"We spend more on health care than any other country, but we're ranked 47th in life expectancy and 43rd in child mortality.",health-care,True
5,"Thanks to you, in under one week we have the largest GOP (Facebook) page in the Governor's race!","candidates-biography,elections,pop-culture",True
5,"Says Ohio is one of just 17 states with an estate tax, and it has the lowest threshold in the nation.",taxes,True
5,[The state ethics commission] took absolutely the same percent of cuts as most other state agencies. They were somewhere in the 7 percent range same as the governors office.,ethics,True
5,"Rep. Paul Ryans budget proposal cuts nothing from Medicare, Social Security or defense in the next two to three years, and in three years, he does not cut one dime from the debt.","deficit,federal-budget,medicare,military,social-security,abc-news-week",True
1,Says HillaryClintons immigration platform would create totally open borders.,immigration,False
5,"In Iraq, civilian deaths, incidents of bombings, etc., remain very low relative to what was going on last year.",iraq,True
5,"Like Marco Rubio, Sen. Barack Obama had one of the worst attendance records in the Senate.","candidates-biography,congress,florida,foreign-policy,history,job-accomplishments,campaign-advertising,voting-record",True
1,State legislators quietly shifted $2 billion from education to road building in 2013.,"education,state-budget,transportation",False
5,San Antonio is now the largest city in the United States ever to have an African American woman mayor.,"city-government,history,population",True
5,Travis County is surrounded by red counties.,"bipartisanship,elections",True
1,Says the national health care law puts federal bureaucrats between an American citizen and her doctor.,health-care,False
5,Says she is co-owner of Celilo Group Media.,"job-accomplishments,message-machine-2012",True
1,Report: 3 million votes in presidential election cast by illegal aliens.,"elections,immigration",False
1,The stories from women saying he groped or forced himself on them largely have been debunked.,"candidates-biography,crime,history,human-rights,women",False
5,The tuitions in Virginia colleges...have doubled -- 100 percent -- in the last 10 years.,education,True
1,The decision to cancel the trademark of the Washington Redskins is not the Patent and Trademark Office. This is Barack Obama.,sports,False
1,"Under the Iran nuclear deal, we give them $150 billion, we get nothing.","foreign-policy,nuclear",False
5,Says Your kid just ate 16 packs of sugar.,"county-government,public-health",True
5,Young veterans have a higher unemployment rate than people who didnt serve.,"economy,jobs,military,veterans,workers",True
5,Says Iowa Senate candidate Joni Ernst promises to shut down the Department of Education and abolish the EPA.,"education,environment",True
1,I have never asked for nor received a single earmark or pork barrel project for my state.,federal-budget,False
1,Says Hillary Clinton wants to bring in thousands of refugees to America from all around the world without any kind of security screening.,immigration,False
5,Georgia residents file the most insurance claims for lightning strikes in the country.,weather,True
5,"Ohio is losing over 700 family farms a year, some of them just to pay the inheritance tax.","agriculture,economy,taxes",True
1,I recently had the opportunity to vote to give the president limited authority to begin strikes against terrorists in Iraq and Syria.,"foreign-policy,military,terrorism",False
5,"In 2011 alone, 269 New Jerseyans were killed by gun violence.",guns,True
1,Ben Franklin once quipped that only two things in life were certain: death and taxes. I think even he didnt envision that the tax man would visit on the day of your death.,"history,state-budget,taxes",False
1,Federal government reneging on Medicaid payments to Wisconsin caused about $240 million in extra costs in the 2013-15 state budget.,"federal-budget,health-care,medicaid,state-budget",False
5,"This (SCHIP) is socialized medicine. It is going to go to families that make $60,000 a year. Those aren't poor children.",health-care,True
5,"If we keep the minimum wage at the current level, then single-parent families earning the minimum wage at a full-time job will live in poverty in New Jersey.","poverty,workers",True
1,The presidents first major foreign policy speech in Cairo was to apologize for our country.,foreign-policy,False
5,Two-thirds of our economy is a consumer economy.,economy,True
1,The Milwaukee Bucks are actually younger than the Marquette team.,"economy,education,recreation,sports",False
1,Says Connie Mack failed to pay his child support.,"candidates-biography,children,families",False
5,NATO hasn't provided enough troops (in Afghanistan) because they are still angry about us going into Iraq.,military,True
5,Says our unemployment insurance trust fund is broke. Were over a billion dollars in debt to the federal government.,"jobs,state-budget",True
1,Paul Ryan is one of only six House Republicans who voted for Teddy Kennedys bill to force Christian employers to hire LGBT employees.,"civil-rights,gays-and-lesbians,religion,workers",False
1,"The vast majority of the money I got was from small donors all across the country.''	campaign-finance	barack-obama	President	Illinois	democrat	70	71	160	163	9	an interview with CNBC's John Harwood 
5802.json	true	The Democrat-controlled Senate, it hasnt passed a budget in more than 1,000 days.	deficit,federal-budget,job-accomplishments	john-boehner	Speaker of the House of Representatives	Ohio	republican	13	22	11	4	2	a video address
6153.json	half-true	The median income in America has dropped by 10 percent in the last four years.	economy,income,jobs	mitt-romney	Former governor	Massachusetts	republican	34	32	58	33	19	a speech
6515.json	barely-true	Says U.S. Senate hopeful Tammy Baldwin voted for a $1 trillion stimulus bill that included a wasteful $800,000 to replace light bulbs.	energy,federal-budget,stimulus	crossroads-gps	Conservative advocacy group		republican	9	1	4	1	2	a television ad
385.json	true	Says Clinton did not read the National Intelligence Estimate before voting for the Iraq war.	iraq	barack-obama	President	Illinois	democrat	70	71	160	163	9	a speech in Westerville, Ohio
10932.json	barely-true	Thanks to the Act 10 collective bargaining law that took effect four years ago, ACT scores in Wisconsin are now second-best in the country for states where more than half the kids take the exam.	education,government-regulation,job-accomplishments,labor,unions	scott-walker	Milwaukee County Executive	Wisconsin	republican	26	41	32	40	11	a speech
5076.json	mostly-true	Our income, our GDP per capita, is almost 50 percent higher than (it is for) the average European.	economy	mitt-romney	Former governor	Massachusetts	republican	34	32	58	33	19	an editorial board meeting with an Iowa newspaper
12189.json	half-true	Says Rick Scott cut Medicaid so people cant get Obamacare.	health-care,medicaid	rick-scotts-starbucks-heckler	Activist, stay-at-home mom	Florida	activist	0	0	2	0	0	a confrontation with Rick Scott at Starbucks
945.json	half-true	The stimulus bill includes $8 billion for high-speed rail projects, such as a 'magnetic levitation' line from Las Vegas to Disneyland.""","stimulus,transportation",False
5,"Many state and federal agencies have such navigators involved in helping folks maneuver through the often complex processes associated with filing benefits claims, for example -- even buying health insurance.",health-care,True
1,SaysJosh Mandels campaign is under FBI investigation,"campaign-finance,crime,elections",False
1,I have tremendous support from women.,"elections,women",False
1,Says theres not much evidence to suggest that people have (contributed to global warming) or can do very much to change anything.,"climate-change,environment",False
1,"Obama said he would ""stand with the Muslims should the political winds shift in an ugly direction.""","candidates-biography,civil-rights,religion",False
5,Tells President Barack Obama that he also asked former President George W. Bush about how he felt about Americans hating him.,"bush-administration,pundits",True
1,"Says I worked with our Mayor and other commissioners to help save the school year when a budget crisis in Salem threatened to cut four weeks of the school year, including negotiating with teachers to work for free.","city-government,education,message-machine-2012,voting-record",False
1,This is the year Florida becomes a majority minority state.,"census,diversity",False
1,Says Greg Abbott converted over $1 million in federal grant money intended for use to prosecute online sexual predators and other cyber crimes and instead used it to harass and prosecute senior citizens who were assisting other senior citizens in applying for mail-in ballots.,"crime,criminal-justice,elections,legal-issues",False
5,Richard Cordrays nomination to head the Consumer Financial Protection Bureau marks the first time in Senate history that a political party has blocked a nomination of someone because they didnt like the construction of the agency.,"consumer-safety,financial-regulation,government-regulation",True
1,Martin Luther King was a Republican.,"civil-rights,history",False
1,"West has raised $2 million from those that would leave our beaches in ruins, end Social Security and Medicare, and give corporations free reign.","campaign-finance,corporations,medicare,oil-spill,social-security",False
5,Salaries for Virginias teachers are below the national average.,"education,state-budget",True
5,"The U.S. unemployment rate has remained above 8 percent for 43 consecutive months, the longest stretch since the Great Depression.",jobs,True
1,Fewer than 10 percent of those in the House are what anyone would classify as wealthy.,"congress,wealth",False
5,Says Rick Santorum supported (Arlen) Specter over conservative candidates twice.,message-machine-2012,True
5,Ten years ago the Austin Water Utility used a total of 240.3 million gallons. Every summer since then our peak day of water use has been lower.,"city-budget,city-government,water",True
5,"The labor force participation rate -- the share of the potential workforce that is actually working or looking for work-- currently stands below 63%, the lowest level since the 1970s.","economy,jobs",True
1,The incandescent light bulb has no effect whatever on the planet.,"energy,government-regulation,market-regulation",False
1,"The president's plan, even after the end of its withdrawal timeline is reached, will leave in place up to 50,000 U.S. troops.",iraq,False
5,One out of 10 minimum-wage workers in the U.S. live in Texas.,"economy,pundits,workers",True
5,"Ninety-five percent of Oregonians now have health insurance coverage, tens of thousands for the very first time.",health-care,True
5,Former business partner Robert Gay says: The man who helped save my daughter was Mitt Romney.,candidates-biography,True
5,"Among the developed nations, we are the least economically and socially mobile country in the world.","economy,income,labor",True
1,"Bill Nelson voted for a ban on millions of commonly owned firearms, which included many popular hunting and target rifles.",guns,False
1,"More lives have been lost because of the war with the drug cartels in Juarez alone, just a few blocks from the United States of America, than have been lost in the war in Afghanistan.","afghanistan,crime,immigration",False
1,Marco Rubio thinks that government shouldn't be in the health care business at all.,health-care,False
5,Swaziland has the highest rate of HIV infection in the world.,public-health,True
5,"During the Civil War, more than 300,000 Ohioans served in the Union Army -- more per capita than any other state.",history,True
5,"The national debt ""has gone up by $1,729,000,000 during the Isner v. Mahut match.""",federal-budget,True
1,On sequestration,"debt,federal-budget",False
5,Says the city of Portland has one manager for every six front-line workers.,"city-government,government-efficiency",True
5,Georgia ranks 49th for women serving in elected state and federal offices.,"congress,diversity,elections,states,women",True
1,"Says President Barack Obama neversaid, No boots on the ground in Syria.","foreign-policy,military",False
1,Wisconsins Supreme Court justices are deciding fewer opinions in civil and criminal cases than they used to.,"criminal-justice,legal-issues,supreme-court",False
5,Six justices on the U.S. Supreme Court have been confirmed in presidential election years since 1912.,"congress,legal-issues,supreme-court",True
5,Sen. Obama has never taken on his party leaders on a single major issue.,candidates-biography,True
1,Says President Obamas grandmother in Kenya said he was born in Kenya and she was there and witnessed the birth.,obama-birth-certificate,False
1,We have more people working in the state of New Jersey today than weve ever had in our history.,"economy,jobs,states",False
5,"When I served as City Commissioner, we made great strides we successfully fought for, and won, adding women and people of color to the Fire Bureau.",diversity,True
1,Nevada is still a state that is 80 percent white voters.,"diversity,elections",False
5,"We have lost 600,000 jobs over the period of the last 10 years. Only Michigan and California have done worse.","economy,jobs",True
5,"We have an 80 percent graduation rate in high school after spending more per student than any country in the world other than Liechtenstein, I think, or Luxembourg and a couple other small countries.",education,True
5,"The health care bill will subsidize families of four that make more than $80,000 a year.",health-care,True
1,"Says an estimate that Texas will face an $18 billion budget gap is a number that somebody just reached up in the air and grabbed.""",state-budget,False
1,On whether he would run for U.S. Senate in 2012.,elections,False
1,"Thirty-seven percent of Central Falls retired police officers and firefighters are out on disability pensions; in most municipalities, about 5 percent of retirees collect disability pensions.","city-budget,city-government,disability,government-efficiency,labor,public-safety,retirement,unions",False
5,"In 2008, 33.2 percent of those who voted early on the last Sunday before Election Day were African-American, while 23.6 percent were Hispanic.",elections,True
5,"47 - New provisions ObamaCare charges the IRS with implementing, according to the Government Accountability Office.","health-care,taxes",True
5,Brewpubs cant sell growlers of their beer to customers.,"Alcohol,market-regulation,states",True
5,Did U know? Block Island Wind Farm would mean 40% est. drop in BI electric rates.,"energy,infrastructure",True
5,"We have over 300,000,000 weapons, firearms in this country. Thats almost as big as the population.",guns,True
1,Theres still about $400 billion or $500 billion of the stimulus plan that has not been spent. Why dont we stop it.,"federal-budget,stimulus,taxes",False
5,The Pink Pony club in DeKalb County has never been cited for any violation of an ordinance or state law.,legal-issues,True
5,"Since 2008, Gwinnett Countys population has grown 15 percent, while the county government staff has increased only 1 percent.","census,county-budget,county-government,economy,jobs,public-safety,public-service,workers",True
5,Harry Reid was against (the nuclear option) before he was for it. Mitch McConnell was for it before he was against it. President Obama was against it before he was for it.,congressional-rules,True
5,Says David Jolly refused to cut spending for a national greenhouse in D.C.,federal-budget,True
5,The Walton family of Walmart ... This one family owns more wealth than the bottom 40 percent of the American people.,"economy,wealth",True
1,"Says Rand Paul thinks drug-dealing, theft, burglary and prostitution should be decriminalized.","crime,message-machine",False
1,"When Sarah Palin was in government, Barack Obama was a community organizer.",candidates-biography,False
1,Says his 9-9-9 tax reform plan is not regressive.,taxes,False
1,"Insurers delayed an Illinois man's treatment, and he died because of it.",health-care,False
5,"An audit shows there are 6.5 million people who have active Social Security numbers who are 112 years of age or older,",social-security,True
5,"Says President Barack Obama will not utter the words radical Islamic terrorism and as matter of policy, nobody in the administration will say the words radical Islamic terrorism.","islam,terrorism",True
5,More than 64 percent of minimum-wage earners are women.,workers,True
1,Under the Obama plan . . . all the health care in this country is eventually going to be run by the government.,health-care,False
1,"Ryan Sittons company accepted over $650,000 in Obama stimulus dollars.","candidates-biography,small-business,stimulus",False
1,"Some of the things that (Megyn Kelly) said, I didnt say.",women,False
5,Says an amendment specifying when military members may use deadly force does nothing to change existing rules of engagement for American service members.,"afghanistan,iraq,legal-issues,voting-record",True
5,Sometimes I was the only no vote on the entire board.,voting-record,True
1,We can fix our roads without raising taxes.,"taxes,transportation",False
1,Obama couldn't have afforded his home without Rezko's help.,ethics,False
5,Obama Skips Out On Condemning Left-Wing Attacks On Gen. Petraeus Despite Casting Other 'Important Votes' Earlier And Later In The Day.,iraq,True
1,"The Clintons now charge the Secret Service $10,000 monthly rent for the use of (a) Secret Service residence and that rent is just about equal to their mortgage payment.",candidates-biography,False
1,Says an appointed board created under Obamacare will have the ability to come between you and your doctor in determining the best treatment options for you!,health-care,False
1,David Cicilline is the 5th most liberal person in the House of Representatives.,"candidates-biography,job-accomplishments",False
5,We have the highest corporate tax rate in the world. Its 35 percent.,"corporations,jobs,taxes",True
5,"Says that in his first 17 months as president, the United States doubled its world-leading $500 million a year commitment to fighting global AIDS.","federal-budget,foreign-policy,health-care",True
5,"When we passed (the stand your ground law), we said it portends horrific events when peoples lives were put into these situations.","crime,criminal-justice",True
5,Weve seen more anti-womens choice bills introduced in the first half of this session than weve seen in the last three General Assemblies.,abortion,True
5,"Already this calendar year, since January 1, we have had more than 20,000 people come across the border, apprehended, unauthorized.","crime,criminal-justice,immigration",True
5,Jim Renacci tried to avoid paying taxes on nearly $14 million that he made.,"message-machine-2012,campaign-advertising,taxes",True
5,"Barack Obama accepted $200,000 from executives and employees of oil companies.",energy,True
1,"In an interview with the Chicago TribunesEditorial Board, Comptroller Leslie Munger says that in order to balance a budget, the state would have to cut social services completely.","elections,state-budget",False
5,The unemployment rate among blacks in Texas is 9.5% -- far more than double white unemployment -- and wages have fallen for black workers in Texas since 2000.,"economy,education,jobs",True
1,Says U.S. Rep. Tammy Baldwin is backing President Barack Obamas plan to pass a $1.5 trillion tax increase.,"deficit,federal-budget,taxes",False
1,"A proposed revenue smart cap gives Floridians a voice, requiring a 60 percent vote by citizens in order to impose a new tax, fee, license, fine, charge or assessment.","state-budget,taxes",False
5,Fourteen million Americans mortgages are greater than the value of their homes.,"economy,housing",True
5,"Weve created more than 850,000 jobs, more than all the other states combined.","economy,message-machine",True
1,"If 20 million illegals vote, you can kiss the Second Amendment goodbye.","guns,immigration,message-machine-2014",False
1,Planned Parenthood has now (been) found to also illegally sell baby parts.,abortion,False
5,Anyone can die of a toothache.,"health-care,medicaid",True
5,Says Jim Frishe wanted to tax us for doing our taxes through an accountant.,"message-machine-2012,taxes",True
1,Perry pushed for a law that lets insurance companies raise homeowners rates without having to justify the increase.,"candidates-biography,consumer-safety,message-machine",False
5,Jason Carter backed three of Nathan Deals budgets but accuses the governor of underfunding education.,education,True
5,On oil drilling off Floridas coast,"environment,oil-spill",True
1,Says sixty-two percent of small businesses over the last five years went under because they couldnt pay their health care bills.,"health-care,small-business",False
1,Jesus was an undocumented immigrant.,immigration,False
1,On gay marriage,"gays-and-lesbians,marriage,voting-record",False
1,"Ann Kuster supports the government takeover of healthcare, which robs Medicare of over $700 billion.","health-care,message-machine-2012",False
1,Its four or five states where the number of insurance options have narrowed under the Affordable Care Act.,health-care,False
5,Says a 1915 referendum on womens right to vote went down in New Jersey. And it took the Legislature to pass it.,women,True
1,Says U.S. House candidate Carlos Curbelo supported ending the Medicare guarantee.,medicare,False
1,"The Obama administration ""was successful in rushing a massive spending bill through Congress in just two days after which it sat on the president's desk for three days, while he was away on vacation.""","economy,health-care,pundits",False
1,"In 1992, Barack Obama directed ""Project Vote - an arm of ACORN that also encouraged voter registration.""",candidates-biography,False
5,"Fleeing Syria, a million children are now refugees.","foreign-policy,military",True
