Labels,Text,Text_Tag,Label_Text
1,FCAT tests account for less than 1 percent of the instructional time provided during the year.,"children,corrections-and-updates,education",False
5,Obama put a 10 percent tax on tanning.,health-care,True
5,Says he sued Obamas EPA seven times.,"energy,environment",True
5,"President Obama will now own 60 percent of GM, and his union buddies will own almost 20 percent.","bankruptcy,market-regulation",True
1,"Says that since lawmakers acted, we have 130 new businesses across Texas doing helicopter hog hunts.","animals,recreation,sports",False
1,"Gas prices have doubled because Obama opposed exploring for energy in Alaska. He gave millions of tax dollars to Solyndra, which then went bankrupt. And he blocked the Keystone pipeline. So we will all pay more at the pump.","climate-change,energy,gas-prices,message-machine-2012",False
5,Californias credit rating is the worst in the country.,"economy,message-machine,state-budget",True
1,"Says Lee Leffingwell has been mayor of Austin, Texas for about as long as Sarah Palin was governor of Alaska.","candidates-biography,pundits",False
1,"Because of President Barack Obamas failure to push job creation, the black unemployment rate in Ferguson, Mo., is three times higher than the white unemployment rate.","criminal-justice,jobs",False
1,Says the National Labor Relations Board told Boeing that it couldnt build a factory in South Carolina because South Carolina is a right-to-work state.,"labor,message-machine-2012",False
5,"Since Newtown, more people have died at the end of a gun than we have lost in Afghanistan.",guns,True
1,"The Trump Winery near Charlottesville, Va. is the largest winery on the East Coast.","economy,trade",False
5,Only 18 percent of jobs are accessible by transit for metro Atlanta residents. 33 percent for those living in the city.,"economy,transportation",True
5,"With those first principles, it allowed a fellow like me to get in his truck and go from one end of the state to the other; started 20 points down and wound up 20 points ahead on election night.",elections,True
5,That luxury jet was over the top. I put it on eBay.,transportation,True
1,On supporting the budget proposed by Rep. Paul Ryan,"federal-budget,medicare",False
5,"John McCain opposed bankruptcy protections for families ""who were only in bankruptcy because of medical expenses they couldn't pay.""",bankruptcy,True
1,Claims Supreme Court Justice Ruth Bader Ginsburg said she prefers the South African Constitution over the United States Constitution.,"legal-issues,supreme-court",False
5,Our national debt ... is on track to exceed the size of our entire economy ... in just two more years.,federal-budget,True
1,Says we could have saved ourselves the cost of building the Powell Butte water reservoir.,"city-government,government-regulation,message-machine-2012,market-regulation,water",False
1,Says challenger Dominic Chavez is a Rick Perry Republican lobbyist.,candidates-biography,False
5,"If you take into account all the people who are struggling for work, or have just stopped looking, the real unemployment rate is over 15 percent.","economy,jobs",True
5,A congressional laundry closed due to the partial government shutdown.,"debt,federal-budget",True
1,"Says that under City Council Member Randi Shade, Austin had the highest city debt per person in Texas.","city-budget,city-government",False
5,Gross income tax receipts are exceeding the Administrations projections for this fiscal year prior to Sandy.,state-finances,True
5,"Because of a local version of Amendment 4, the taxpayers of St. Pete Beach have had to pay hundreds of thousands in legal bills.","economy,florida-amendments,taxes",True
1,The cheerleaders for the Dallas Cowboys have entertained more troops in the world than Bob Hope.,"corrections-and-updates,military",False
5,The Capitol rotunda was actually made to invite the people in and to accommodate protests.,legal-issues,True
1,"Over 214,000 doctors opt out of Obamacare exchanges.",health-care,False
1,Says a $12.5 million incentive deal she approved for Abbott Laboratories contained strong protections for taxpayers if job creation goals were not met.,"jobs,state-budget",False
5,The United States has one of the highest corporate tax rates in the world.,"corporations,economy,taxes",True
1,A legacy of taxing and borrowing crippled the economy we inherited two years ago.,"corrections-and-updates,economy,state-budget,state-finances,taxes",False
5,"Charlie Crist ""bizarrely vetoed"" $9.7 million for a teaching hospital at the University of Florida ""despite having previously argued the budget request had merit.""","health-care,state-budget",True
1,Says Barack Obama has gone from blaming George W. Bush to plagiarizing George W. Bush.,pundits,False
1,Donald Trump says all Mexicans are rapists.,immigration,False
1,2008: Unions Spent $400 Million to Elect Obama.,"campaign-finance,elections",False
1,"Says Mary Burkes 2007-09 state budget had a tax hike of $1.8 billion -- costing every man, woman and child in the state an extra $310.","state-budget,state-finances,taxes",False
5,"Under current law, if you go on a dating website and you say youre 32 and youre actually 42, youve committed a misdemeanor.","legal-issues,pop-culture,technology",True
5,The proposed raises for the Norcross City Council would put it in line with other liked-sized communities.,"city-budget,city-government",True
5,"There has never been a death caused by a [commercial nuclear] reactor in the United States, even when Three Mile Island failed in the 1970s.",nuclear,True
5,"Obama spent ""40 percent of the PAC money, 43 percent to be exact, on Iowa, New Hampshire, Nevada and South Carolina politicians.""",ethics,True
5,Says Texas ranks last in the percentage of residents with high school diplomas.,"education,pundits",True
1,The climate hasnt warmed in quite a few years. That is proven scientifically.,"climate-change,environment,weather",False
5,Says Bruce Springsteen played in 1975 at Seton Hall University in South Orange at Walsh gym.,pop-culture,True
1,A North Carolina study proves that probably over a million people voted twice in (the 2012) election.,elections,False
1,Tarpon Springs takes its homeless to St. Petersburg.,"poverty,urban",False
5,The overall fact about illegal immigration is that its not actually getting worse.,"immigration,pundits",True
5,More people are apprehended after illegally crossing the U.S.-Mexico border a week than are born in Texas each week.,"children,immigration,population",True
5,"For more than 30 years after World War II, there was a steady reduction in U.S. debt as a percentage of gross domestic product.","deficit,economy",True
5,"While I was working on those streets watching those folks see their jobs shift overseas, you were a corporate lawyer sitting on the board at Wal-Mart.",candidates-biography,True
1,"When President Franklin D. Roosevelt started Social Security, it only affected widows and orphans, and when Medicare began, it was a small program.","children,disability,health-care,history,medicare,social-security",False
5,The deficit was on track to top $1 trillion the year I took office.,"deficit,federal-budget",True
1,Says Hillary Clinton refuses to testify before Congress about the 2012 attack in Benghazi.,"foreign-policy,terrorism",False
1,Commerce Secretary nominee John Bryson appears to endorse world government.,"cap-and-trade,climate-change,energy,environment",False
1,Says Rob Portman even voted to allow people on the terrorism watch list to buy guns.,"corrections-and-updates,guns,terrorism",False
1,ISIS leader Abu Bakr al Baghdadi was released by Obama in 2009.,"iraq,terrorism",False
5,The NRA used to support expanded background checks.,guns,True
1,"In the history of Republican primaries, Ive gotten the most votes in the history of the Republican party.",elections,False
1,"When the New Hampshire Legislature raised the gasoline tax, gas prices in the state were skyrocketing.","energy,taxes",False
5,Says that in the U.S. House of Representatives weve had bipartisan support for the repeal of Obamacare for getting rid of cap and trade for building the Keystone Pipeline.,"bipartisanship,climate-change,congress,congressional-rules,voting-record",True
1,"We will spend $100 billion in Afghanistan this year, fixing roads, building bridges, training police officers, and more, [and] cutting the same things in our own country.","afghanistan,deficit,federal-budget,infrastructure,military",False
5,Wrong precinct rules exacerbate our provisional ballot problems (and) HB 194 does nothing to solve the wrong-precinct problem.,elections,True
5,Says Donald Trump used undocumented labor to build the Trump Tower.,"candidates-biography,immigration",True
5,Sharron Angle would eliminate the Department of Education.,"education,legal-issues,message-machine,states",True
1,On whether BPs $20 billion fund to compensate oil spill victims is a slush fund.,"energy,environment,oil-spill",False
1,On in-state tuition for illegal immigrants.,"education,immigration",False
5,The five economic indicators that the federal government tracks - for the first time since August 2006 - were positive this October.,economy,True
1,What were the old annual deficits under Republicans have now become the monthly deficits under Democrats.,"federal-budget,stimulus",False
5,"Says a poll shows that without a name attached, Democrats are just one point behind Gov. John Kasich.","elections,polls",True
1,We spend almost twice as much per capita on health care as do the people of any other country.,health-care,False
1,On repealing the 17th Amendment,"debates,elections,states",False
5,My property taxes went down largely because my technical college portion went down 35.5% because of the money we put in at state.,taxes,True
1,"Lots of studies seem to indicate that minors find it very easy to get marijuana, easier than to get alcohol.","Alcohol,children,drugs,marijuana",False
1,Says President Obamas decision to not issue a permit for the Keystone XL pipeline meant we were denied the ability immediately to reduce prices at the pump.,"climate-change,economy,energy,gas-prices",False
5,Says she is the subject of 60 books.,candidates-biography,True
5,"In writing his book, Gov. Perry pointed out that by any measure Social Security has been a failure.",social-security,True
1,The health care law reduces the number of uninsured in America by 3 percent for how much money? $2 trillion.,"federal-budget,health-care",False
1,We import more oil today than ever before.,energy,False
5,"Will Hurd tends to have a 96 percent straight Republican, straight party voting record.","bipartisanship,congress,redistricting,voting-record",True
5,Greece is not a big economy. Its about the size of metropolitan Miami.,"economy,foreign-policy",True
5,Forty cents of every dollar being spent by the federal government is being borrowed from my children.,federal-budget,True
5,Cigarette butts poison babies and small children because of the nicotine in them.,"children,environment,public-health",True
5,"Since I took office, over 319,000 new private sector jobs have been created in Georgia with nearly 93,000 of those coming in the past 12 months.","economy,jobs",True
1,Says President Obama was proposing pinprick strikes for military intervention in Syria.,"candidates-biography,foreign-policy,military",False
1,Says there are no political prisoners in Cuba.,human-rights,False
5,"First, he said he would leave residual forces in Iraq, and now he says he wouldn't.",iraq,True
5,"When Sen. Edwards ran in 2004, he wasn't for universal health care. I'm glad he is now.",health-care,True
5,Says Multnomah County libraries are open 44 hours per week the lowest of any library in the four-county region.,taxes,True
5,Says Mike Huckabee appeared in diabetes infomercials to endorse cures and treatments that no health agency supports.,"candidates-biography,health-care,science",True
1,"Says EPA regulation of greenhouse gases will endanger 575 Texas dairy facilities, 58 swine operations, 1,300 corn farms and 28,000 beef cattle operations.","energy,environment",False
1,"The Employment Non-Discrimination Act discriminates against Christian daycare, Christian parents, Christian business owners, and the rights of religious freedom.","gays-and-lesbians,religion,workers",False
5,"Now, I also support the Bush tax cuts. Sen. McCain voted against them originally. He now believes they should be made permanent. I'm glad he agrees they should be made permanent.",taxes,True
5,The mosquito population in South Florida is larger than it is in many other communities in the country.,"environment,public-health",True
5,"When the City and the Fairmount Park Conservancy invested $5 million in Hunting Park, crime went down 89 percent within a half mile radius of the park over the next three years.",public-safety,True
5,Lets start with the premise that Rhode Island already has one of the 10 strictest [gun laws] amongst all the states.,guns,True
5,"Says in our region, 2011 was worst drought year ever recorded.","environment,water,weather",True
1,"In the 1980s, The lowest income people had the biggest gains.","economy,history,income,pundits,taxes",False
1,"For every one job created under the Obama administration, 75 people went on food stamps.","economy,hunger,jobs,poverty",False
5,"If we got solar energy from an area of the Southwestern desert 100 miles on a side, that would be enough, in and of itself, to provide 100 percent of all the electricity needs for the United States of America in a full year.",environment,True
5,Says Bernie Sanders was there when it came to (same-sex) marriage 20 years ago. ... He was there when it wasnt popular.,"civil-rights,corrections-and-updates,gays-and-lesbians,marriage",True
1,The administration has issued rules for $1 abortions in ObamaCare and requires all persons enrolled in insurance plans that include elective abortion coverage to pay an abortion premium.,"abortion,health-care",False
1,Says Gov. Rick Perry has never held a private-sector job.,candidates-biography,False
1,Illegal immigration costs state taxpayers over $3 billion every year.,"immigration,state-finances",False
1,"Says a liberal immigration reform group endorsed his GOP primary opponent, Dave Brat.",immigration,False
1,Welders make more money than philosophers.,"education,income,jobs",False
5,Teddy Roosevelt first called for (health care) reform nearly a century ago.,health-care,True
5,"Charlie Crist broke the quarter ""record for fundraising in a U.S. Senate race in Florida.""",florida,True
1,The American people spoke pretty loudly. They said stop all the looming tax hikes....,taxes,False
1,"For the hour after the (Jan. 14) debate, Debra Medina was the No. 1 search on Google and for the remainder of that night No. 3.","elections,job-accomplishments,pop-culture",False
5,"When (John) Brennan ... was asked directly Is there any geographic limitation to your drone strike program? Brennan responded and said, no, there is no limitation.","civil-rights,terrorism",True
5,"Says Time magazine called him ""one of America's best governors.""",job-accomplishments,True
5,On supporting the Supreme Court abortion decision Roe v. Wade,abortion,True
1,After four years of a celebrity president 85% (of recent college grads are) moving back in with their parents.,"jobs,message-machine-2012",False
1,I was totally against the war in Iraq.,iraq,False
5,"There have been literally hundreds of new tax preferences and loopholes added to the code since 1986, last time we did this.",taxes,True
1,Says Suzanne Bonamici supports the $500 billion cut to Medicare passed last year.,"health-care,medicare",False
1,"1928 was last time Republicans had the White House, the House and the Senate.",history,False
1,Hillary Clinton and Barack Obama want to raise taxes on all income brackets.,taxes,False
1,U.S. Sen. Saxby Chambliss votes more with Democrats than with conservatives.,"federal-budget,voting-record",False
5,"For the second quarter in a row, my campaign has raised more money than any other challenger in the nation and brought our fundraising total to over $800,000.",campaign-finance,True
5,She stood by ground zero workers who sacrificed their health after so many sacrificed their lives and kept standing till this administration took action.,health-care,True
1,This is the first time since World War II that five nuclear-powered aircraft carriers were docked together.,military,False
5,"At the 50 Milwaukee schools serving at least 80% African-American and at least 80% low income students, the reading proficiency is 8%.",education,True
1,"If you're a small business and don't ""adopt the health care plan that Senator Obama mandates, he's going to fine you.""",health-care,False
1,"New jobs numbers are in, and Wisconsin has fallen to dead last in Midwest job growth.",jobs,False
1,Under the Baucus bill ... federal funds would subsidize coverage of elective abortions.,"abortion,health-care",False
1,Cap-and-trade is wildly unpopular with Americans.,"cap-and-trade,climate-change,energy,environment",False
5,By registration fewer than 20 percent of Florida voters are Independents.,elections,True
1,Teachers were not involved in developing the Common Core State Standards.,education,False
1,This (parent trigger) legislation was drafted by President Obamas top advisers. It was drafted by President Clintons top advisers.,education,False
5,"Today, we import triple the amount of oil than we had on the day Senator McCain took office.",energy,True
5,Says four-year terms for City Council members are the norm in most cities of our size.,city-government,True
5,"Tommy Thompson is the father of welfare reform, creating the groundbreaking Wisconsin Works program in Wisconsin that became the model for national and international reforms.",job-accomplishments,True
5,We now sell more products made in America to the rest of the world than ever before.,"corrections-and-updates,trade",True
5,The costs of cancer and all affiliated issues are over $20 billion a year to this state.,health-care,True
1,On a cap-and-trade plan.,"cap-and-trade,climate-change,jobs",False
1,The left is blatantly attempting to disrupt Georgias elections.,elections,False
5,President Barack Obama reduced the cost of prescription drugs for nearly 3.6 million Americans in 2011.,"health-care,medicare,message-machine-2012",True
1,Says Ted Cruz is a supporter of legalizing people that are in this country illegally and proposed giving them work permits.,immigration,False
1,On whether he wrote a provision that allowed AIG to dole out bonuses.,economy,False
5,"Countries bombed: Obama 7, Bush 4","foreign-policy,military",True
1,U.S. Rep. Debbie Wasserman Schultz has blamed the Republicans for the creation of Hamas.,israel,False
5,"Hillsboroughs Public Transportation Commission has a rule that says cabbies have to wear socks. I mean, please. Come on.",government-efficiency,True
5,"Here in Virginia, we have the opportunity to become the first state on the East Coast to explore for and produce oil and natural gas offshore.","energy,states",True
1,The McCain campaign is roughly in the position where Vice President Gore was running against President Bush one week before the election of 2000.,elections,False
1,"Health care reform: Everything about it is going to raise costs, raise taxes and lower the quality of health care.",health-care,False
1,"Since 1965, the United States has spent untold trillions yet the poverty rate hasnt budged.","federal-budget,history,poverty,pundits",False
1,New Jersey is the only state in the union that spent less on higher education than it did at the beginning of the decade.,"education,state-finances",False
5,A million people a year come into the U.S. legally. No other country even comes close to that figure.,immigration,True
5,"When the Republicans were in charge, they actually expanded government health care with the prescription drug program.","health-care,medicare,new-hampshire-2012",True
1,On the Trans-Pacific Partnership.,trade,False
1,"Says that when Congressman (Steve) Cohen took office in 2007, the unemployment rate was at 4.8 percent. The unemployment rate in Shelby County has reached 9.7 percent.",jobs,False
5,The Koch brothers are one of the biggest polluters in the country.,environment,True
1,Says Texas is the only state that exempts jet fuel from its state motor fuels tax.,"state-budget,state-finances,taxes",False
5,Says A baby in Coos County is two times as likely to be born to a mother who is someone who used tobacco during her pregnancy as is the average baby born in Oregon or the U.S.,"county-government,public-health,taxes",True
5,"From a standpoint of the county government, neither school system has received an increase in funding over the past six years.","county-budget,county-government,education,taxes",True
1,On reconciliation,"bipartisanship,health-care,legal-issues",False
1,Virginias current unemployment rate is the lowest in Virginia history.,"economy,jobs",False
5,Trenton politicians cut $1.3 billion from education.,"education,state-budget,state-finances",True
1,"A new Colorado law literally allows residents to print ballots from their home computers, then encourages them to turn ballots over to collectors.",elections,False
1,"During the Eisenhower Administration, not a single soldier died in combat.","foreign-policy,history,military",False
5,On the Keystone XL pipeline,environment,True
1,"California Senator, Democratic Senator Dianne Feinstein said if she could say to Mr. America and Mrs. America, Give me your guns, Im rounding em up, she would.",guns,False
1,Says he has supported George Bush more than I have Barack Obama.,voting-record,False
1,"By 2015, we will be sending so much interest to China that we will be paying for the entire Peoples Liberation Army.","china,deficit,foreign-policy,military",False
1,Says the U.S. Senate has passed a budget over the last three years called the Budget Control Act.,federal-budget,False
1,Medicare officials have treated Humana and AARP inconsistently on how they can communicate with seniors.,"health-care,medicare",False
1,The Islamic State just built a hotel in Syria.,terrorism,False
5,The Iranians are now saying that what were saying the deal is and what they understand it to be are two different things.,"foreign-policy,nuclear",True
5,The federal government has 77 different means-tested social welfare programs.,"federal-budget,government-efficiency",True
5,I have returned money every year since taking office.,congressional-rules,True
5,"In the last 15 years, weve witnessed a dramatic expansion in the jailing of immigrants, from about 70,000 people detained annually to about 400,000.",immigration,True
1,Says Maryellen OShaughnessy accepted campaign cash from indicted politician Jimmy Dimora.,campaign-advertising,False
5,"You know, the approval rating of Congress is down to 13 percent.",ethics,True
5,"In Oregon, students are skipping math class to learn about the Bible.","education,religion",True
5,The United States right now incarcerates more African-Americans as a percentage than apartheid South Africa did.,criminal-justice,True
5,"Before 2005, the percentage of Texas high school students meeting the college readiness standards of the Texas Higher Education Coordinating Board stood at 28% in English and 42% in math. Those figures stood at 65% and 66% in 2013.","children,education",True
1,Georgia has a well-deserved reputation for setting the gold standard for food safety.,food-safety,False
1,"If lawmakers fail to avert the fiscal cliff, 18 percent of the federal money that is sent to the states will be eliminated.","debt,deficit,federal-budget,state-budget,state-finances,states",False
5,"In 2011, the average annual compensation for a teacher in the Milwaukee Public Schools system will exceed $100,000.","education,labor,state-budget",True
1,Says U.S. Rep. Paul Ryans budget proposal eliminates Medicare in 10 years.,"federal-budget,medicare",False
1,About 800 people refused to get a drug screening because they are out there on drugs.,"drugs,welfare",False
1,Says Tom Hughes supports paving over thousands of acres with over-development and sprawl.,"environment,housing",False
5,David Cicilline was the state representative who opposed tough mandatory sentences for those convicted of domestic violence and child abuse.,"candidates-biography,children,crime,criminal-justice,families,public-safety,women",True
1,Bill White ...offered sanctuary to illegal immigrants.,immigration,False
5,The GOP platform that seeks further limits on abortion and is silent on an exception for rape has been there for more than 30 years.,abortion,True
1,"Under the new Arizona immigration law, police can't stop someone to check their immigration status unless they think they see something illegal.","immigration,legal-issues",False
5,Fox News uses photo of a married couple promoting traditional marriage and the photo is actually of a same-sex couple.,gays-and-lesbians,True
1,"Every time we raise the minimum wage, the number of jobless people increases.","economy,jobs,workers",False
5,Trump Management was charged with discriminating against African-Americans and breaking federal law.,"candidates-biography,civil-rights,housing,legal-issues",True
5,The National Park Service has an annual budget that is less than the city of Austin.,"city-budget,city-government,federal-budget,recreation",True
5,It is ironic that (First Energy Corp. is) going to have a name on our (football stadium) where we (Cleveland Public Power) supply the electricity.,"city-budget,energy,infrastructure",True
5,"In 2011, more people were murdered with knives, hands or feet or clubs and hammers than with any type of rifle.",guns,True
1,"As governor, Tim Kaine oversaw a huge increase in illegal immigration, a tremendous increase.",immigration,False
1,Virginias banning of felons from voting is a Jim Crow-era law.,"civil-rights,history",False
